{
  "schema_version": "1.0",
  "stage": "landscape",
  "mode": "textbook_cover",
  "text_budget_chars": 18000,
  "text_chars_used": 3200,
  "resources": [
    {"kind": "json", "path": "analysis/style_dna.json", "text_chars": 1800, "character_id": null},
    {"kind": "prompt", "path": "skill/prompts/landscape-three-concepts.md", "text_chars": 1400, "character_id": null},
    {"kind": "image", "path": "controls/landscape_v3.png", "text_chars": 0, "character_id": null}
  ],
  "created_at": "2026-08-28T00:00:00Z"
}
